{
  "schemaVersion": 2,
  "id": "food-tgi-fridays-trinidad-fried-mozzarella",
  "slug": "fried-mozzarella-trinidad",
  "kind": "food",
  "title": "Fried Mozzarella",
  "summary": "Fried mozzarella with marinara; share plate, not a full meal. Posted menu price TT$55.",
  "description": "Fried mozzarella with marinara; share plate, not a full meal. Listed price is a standing menu price, not a temporary discount. Confirm price, serving size, stock and branch participation before ordering.",
  "status": "published",
  "confidence": "high",
  "createdAt": "2026-09-24T18:17:30.059Z",
  "updatedAt": "2026-09-24T18:17:30.059Z",
  "publishedAt": "2026-09-24T18:17:30.059Z",
  "checkedAt": "2026-09-24T18:17:30.059Z",
  "places": [
    {
      "name": "TGI Fridays Trinidad",
      "area": "Trinidad",
      "region": "Trinidad",
      "address": null,
      "mapUrl": null
    }
  ],
  "price": {
    "currency": "TTD",
    "amount": 55,
    "fromAmount": null,
    "label": "TT$55 menu price",
    "terms": "Standing menu listing; prices and availability may vary by branch."
  },
  "validity": {
    "startsAt": null,
    "endsAt": null,
    "recurrence": "Available while listed on the current TGI Fridays Trinidad menu; kids’ items are children’s portions. Prices may be subject to VAT.",
    "timezone": "America/Port_of_Spain"
  },
  "categories": [
    "budget-menu",
    "menu-price",
    "pescatarian-option"
  ],
  "sources": [
    {
      "url": "https://tgif-tt.com/our-food/",
      "publisher": "TGI Fridays Trinidad",
      "type": "official",
      "supports": [
        "offer",
        "price",
        "location"
      ],
      "checkedAt": "2026-09-24T18:17:30.059Z"
    }
  ],
  "research": {
    "service": "OpenAI Codex",
    "model": "GPT-6"
  },
  "editorialNote": "Current menu listing checked 2026-09-24. This entry records posted menu pricing; it is not a claim of a limited-time discount. Dietary fit is conservative where ingredients are not fully published.",
  "food": {
    "items": [
      "Fried Mozzarella"
    ],
    "dietFit": {
      "pescatarian": "yes",
      "dairyFree": "no",
      "vegan": "no"
    },
    "dietNotes": "Menu listing identifies plant-based/vegetarian ingredients, but does not establish a fully dairy-free recipe. Verify bread, sauces, toppings and preparation."
  }
}
