{
  "schemaVersion": 2,
  "id": "food-jaxx-chocolate-fudge-cake-the-cheesecake-factory-jaxx",
  "slug": "chocolate-fudge-cake-the-cheesecake-factory-jaxx",
  "kind": "food",
  "title": "Chocolate Fudge Cake - The Cheesecake Factory",
  "summary": "Chocolate Fudge Cake - The Cheesecake Factory · TT$92.00 menu price at Jaxx International Grill.",
  "description": "Chocolate Fudge Cake - The Cheesecake Factory is listed on the current Jaxx International Grill Trinidad menu for TT$92.00. Confirm current price and branch participation before ordering.",
  "status": "published",
  "confidence": "high",
  "createdAt": "2026-09-25T12:00:00.000Z",
  "updatedAt": "2026-09-25T12:00:00.000Z",
  "publishedAt": "2026-09-25T12:00:00.000Z",
  "checkedAt": "2026-09-25T12:00:00.000Z",
  "places": [
    {
      "name": "Jaxx International Grill",
      "area": "Trinidad",
      "region": "Trinidad",
      "address": null,
      "mapUrl": null
    }
  ],
  "price": {
    "currency": "TTD",
    "amount": 92,
    "fromAmount": null,
    "label": "TT$92.00 menu price",
    "terms": "Regular posted menu price; not a limited-time discount. Confirm the current price and participating branch before ordering."
  },
  "validity": {
    "startsAt": null,
    "endsAt": null,
    "recurrence": "Listed on the current menu at the source URL; availability may vary by branch.",
    "timezone": "America/Port_of_Spain"
  },
  "categories": [
    "menu-price",
    "budget-eats",
    "trinidad"
  ],
  "sources": [
    {
      "url": "https://tt.jaxxinternationalgrill.com/product/chocolate-fudge-cake-the-cheesecake-factory/",
      "publisher": "Jaxx International Grill — Trinidad menu",
      "type": "official",
      "supports": [
        "menu item",
        "price"
      ],
      "checkedAt": "2026-09-25T12:00:00.000Z"
    }
  ],
  "food": {
    "items": [
      "Chocolate Fudge Cake - The Cheesecake Factory"
    ],
    "dietFit": {
      "pescatarian": "unknown",
      "dairyFree": "no",
      "vegan": "unknown"
    },
    "dietNotes": "Dietary status is only marked when supported by the published menu description. Confirm ingredients and preparation with the restaurant."
  }
}
