{
  "schemaVersion": 2,
  "id": "activity-trinidad-and-tobago-carnival-museum-ttcm-activity",
  "slug": "trinidad-and-tobago-carnival-museum-ttcm-activity",
  "kind": "event",
  "title": "Trinidad and Tobago Carnival Museum (TTCM)",
  "summary": "The Trinidad and Tobago Museum (TTCM) is committed to gathering, protecting, and sharing information on the legacy of T&T Carnival. T&T Carnival is distinctive, and its museum…",
  "description": "The Trinidad and Tobago Museum (TTCM) is committed to gathering, protecting, and sharing information on the legacy of T&T Carnival. T&T Carnival is distinctive, and its museum is sure to be too. The museum will honor freedom and the coming together of peoples in the same way as the festival. Its interactive analog and digital exhibitions will provide visitors a 365-day carnival museum experience. Listed opening hours: Wednesday - Saturday: 10:00AM - 5:00PM Sunday: 2:00PM - 5:00PM. Verify access, opening times and any fees with the site before travelling.",
  "status": "published",
  "confidence": "high",
  "createdAt": "2026-09-25T12:00:00.000Z",
  "updatedAt": "2026-09-25T12:00:00.000Z",
  "publishedAt": "2026-09-25T12:00:00.000Z",
  "checkedAt": "2026-09-25T12:00:00.000Z",
  "places": [
    {
      "name": "Trinidad and Tobago Carnival Museum (TTCM)",
      "area": "Port of Spain",
      "region": "North Trinidad",
      "address": "81 Charlotte Street, Port of Spain",
      "mapUrl": "http://www.ttcarnivalmuseum.com/"
    }
  ],
  "price": {
    "currency": "TTD",
    "amount": null,
    "fromAmount": null,
    "label": "Check admission",
    "terms": "The tourism listing does not provide a fixed price. Confirm current admission or guided-tour fees directly before travelling."
  },
  "validity": {
    "startsAt": null,
    "endsAt": null,
    "recurrence": "Ongoing attraction · check opening hours",
    "timezone": "America/Port_of_Spain"
  },
  "categories": [
    "activity",
    "attraction",
    "trinidad"
  ],
  "sources": [
    {
      "url": "https://visittrinbago.tt/attractions/trinidad-and-tobago-carnival-museum-ttcm",
      "publisher": "Visit Trinidad — official attractions directory",
      "type": "official",
      "supports": [
        "attraction",
        "location",
        "visitor access"
      ],
      "checkedAt": "2026-09-25T12:00:00.000Z"
    }
  ],
  "event": {
    "format": "Ongoing attraction visit",
    "admission": "The directory does not list a fixed admission fee. Contact the site before visiting."
  }
}
