{
  "schemaVersion": 2,
  "id": "activity-scorpion-pepper-food-experience-activity",
  "slug": "scorpion-pepper-food-experience-activity",
  "kind": "event",
  "title": "Scorpion Pepper Food Experience",
  "summary": "Discover Trinidad’s scorpion pepper food culture through an experience listed by the official tourism directory. Confirm host, heat levels and booking details.",
  "description": "Discover Trinidad’s scorpion pepper food culture through an experience listed by the official tourism directory. Confirm host, heat levels and booking details. Check current opening hours, access, prices and booking requirements with the operator or official listing before travelling.",
  "status": "published",
  "confidence": "high",
  "createdAt": "2026-09-25T12:00:00.000Z",
  "updatedAt": "2026-09-25T12:00:00.000Z",
  "publishedAt": "2026-09-25T12:00:00.000Z",
  "checkedAt": "2026-09-25T12:00:00.000Z",
  "places": [
    {
      "name": "Trinidad",
      "area": "Trinidad",
      "region": "Trinidad",
      "address": "Trinidad"
    }
  ],
  "price": {
    "currency": "TTD",
    "amount": null,
    "fromAmount": null,
    "label": "Check admission",
    "terms": "The referenced listing does not establish a fixed price. Confirm current admission, transport and booking fees directly before travelling."
  },
  "validity": {
    "startsAt": null,
    "endsAt": null,
    "recurrence": "Ongoing experience · check opening hours",
    "timezone": "America/Port_of_Spain"
  },
  "categories": [
    "activity",
    "food-experience",
    "trinidad"
  ],
  "sources": [
    {
      "url": "https://visittrinbago.tt/things-to-do/cuisine/",
      "publisher": "Visit Trinidad — official things-to-do directory",
      "type": "official",
      "supports": [
        "activity listing",
        "experience details"
      ],
      "checkedAt": "2026-09-25T12:00:00.000Z"
    }
  ],
  "event": {
    "format": "Food and culture experience",
    "admission": "No fixed admission price is confirmed here; check with the operator or official listing."
  }
}
