{
  "schemaVersion": 2,
  "id": "food-omg-sushi-wonderful-wednesday-two-rolls",
  "slug": "omg-sushi-wonderful-wednesday-two-rolls",
  "kind": "food",
  "title": "OMG Sushi Wonderful Wednesday — 2 rolls for TT$118",
  "summary": "Choose any two rolls from California, Californication, Spicy Tuna, Vegas, Chicken Teriyaki or Wellington for TT$118.",
  "description": "Available Wednesdays for pickup or delivery.",
  "status": "published",
  "confidence": "high",
  "createdAt": "2026-09-25T11:37:54Z",
  "updatedAt": "2026-09-25T11:37:54Z",
  "publishedAt": "2026-09-25T11:37:54Z",
  "checkedAt": "2026-09-25T11:37:54Z",
  "places": [
    {
      "name": "OMG Sushi",
      "area": "Endeavour, Chaguanas",
      "region": "Central Trinidad",
      "address": "Rodney Road, Endeavour",
      "mapUrl": null
    }
  ],
  "price": {
    "currency": "TTD",
    "amount": 118,
    "fromAmount": null,
    "label": "TT$118",
    "terms": "For pickup or delivery; selected options and hours are subject to the linked menu."
  },
  "validity": {
    "startsAt": null,
    "endsAt": null,
    "recurrence": "Every Wednesday; pickup or delivery",
    "timezone": "America/Port_of_Spain"
  },
  "categories": [
    "food-deal",
    "value-meal"
  ],
  "research": {
    "service": "OpenAI Codex",
    "model": "GPT-6 desktop (manual source review)"
  },
  "food": {
    "items": [
      "two selected rolls"
    ],
    "dietFit": {
      "pescatarian": "unknown",
      "dairyFree": "unknown",
      "vegan": "unknown"
    },
    "dietNotes": "Selection includes chicken and seafood; dietary fit depends on choice and preparation."
  },
  "sources": [
    {
      "url": "https://omgsushi.ttmenus.com/specials/wonderful-wednesday-any-2/",
      "publisher": "OMG Sushi via TT Menus",
      "type": "official",
      "checkedAt": "2026-09-25T11:37:54Z",
      "supports": [
        "offer",
        "price",
        "location",
        "terms"
      ]
    }
  ],
  "editorialNote": "Checked against the linked TT Menus item page. Confirm availability with the venue before ordering."
}
