{
  "schemaVersion": 2,
  "id": "activity-chaguaramas-golf-course-trail-activity",
  "slug": "chaguaramas-golf-course-trail-activity",
  "kind": "event",
  "title": "Chaguaramas Golf Course Trail",
  "summary": "The trail from the Chaguaramas Golf Course to Macqueripe entails hiking over a ridge to decend upon views of Macqueripe Beach. The trail is 2.5km in length.",
  "description": "The trail from the Chaguaramas Golf Course to Macqueripe entails hiking over a ridge to decend upon views of Macqueripe Beach. The trail is 2.5km in length. Listed opening hours: 24 HOURS. Verify access, opening times and any fees with the site before travelling.",
  "status": "published",
  "confidence": "high",
  "createdAt": "2026-09-25T12:00:00.000Z",
  "updatedAt": "2026-09-25T12:00:00.000Z",
  "publishedAt": "2026-09-25T12:00:00.000Z",
  "checkedAt": "2026-09-25T12:00:00.000Z",
  "places": [
    {
      "name": "Chaguaramas Golf Course Trail",
      "area": "Chaguaramas",
      "region": "North Trinidad",
      "address": "Bellerand Road, Chaguaramas",
      "mapUrl": "https://chaguaramas.com/tour-golf-to-macqueripe-1"
    }
  ],
  "price": {
    "currency": "TTD",
    "amount": null,
    "fromAmount": null,
    "label": "Check admission",
    "terms": "The tourism listing does not provide a fixed price. Confirm current admission or guided-tour fees directly before travelling."
  },
  "validity": {
    "startsAt": null,
    "endsAt": null,
    "recurrence": "Ongoing attraction · check opening hours",
    "timezone": "America/Port_of_Spain"
  },
  "categories": [
    "activity",
    "attraction",
    "trinidad"
  ],
  "sources": [
    {
      "url": "https://visittrinbago.tt/attractions/chaguaramas-golf-course-trail",
      "publisher": "Visit Trinidad — official attractions directory",
      "type": "official",
      "supports": [
        "attraction",
        "location",
        "visitor access"
      ],
      "checkedAt": "2026-09-25T12:00:00.000Z"
    }
  ],
  "event": {
    "format": "Ongoing attraction visit",
    "admission": "The directory does not list a fixed admission fee. Contact the site before visiting."
  }
}
