{
  "schemaVersion": 2,
  "id": "activity-temple-in-the-sea-360-virtual-experience-activity",
  "slug": "temple-in-the-sea-360-virtual-experience-activity",
  "kind": "event",
  "title": "Temple in the Sea 360° Virtual Experience",
  "summary": "Take an official 360° virtual visit to the Temple in the Sea at Waterloo.",
  "description": "Take an official 360° virtual visit to the Temple in the Sea at Waterloo. Check current opening hours, access, prices and booking requirements with the operator or official listing before travelling.",
  "status": "published",
  "confidence": "high",
  "createdAt": "2026-09-25T12:00:00.000Z",
  "updatedAt": "2026-09-25T12:00:00.000Z",
  "publishedAt": "2026-09-25T12:00:00.000Z",
  "checkedAt": "2026-09-25T12:00:00.000Z",
  "places": [
    {
      "name": "Waterloo",
      "area": "Waterloo",
      "region": "Central Trinidad",
      "address": "Waterloo"
    }
  ],
  "price": {
    "currency": "TTD",
    "amount": null,
    "fromAmount": null,
    "label": "Check admission",
    "terms": "The referenced listing does not establish a fixed price. Confirm current admission, transport and booking fees directly before travelling."
  },
  "validity": {
    "startsAt": null,
    "endsAt": null,
    "recurrence": "Available online; check official page",
    "timezone": "America/Port_of_Spain"
  },
  "categories": [
    "activity",
    "virtual-tour",
    "trinidad"
  ],
  "sources": [
    {
      "url": "https://visittrinidad.tt/360-experiences/",
      "publisher": "Tourism Trinidad",
      "type": "official",
      "supports": [
        "activity listing",
        "experience details"
      ],
      "checkedAt": "2026-09-25T12:00:00.000Z"
    }
  ],
  "event": {
    "format": "Virtual 360° experience",
    "admission": "No fixed admission price is confirmed here; check with the operator or official listing."
  }
}
