{
  "schemaVersion": 2,
  "id": "activity-nature-seekers-activity",
  "slug": "nature-seekers-activity",
  "kind": "event",
  "title": "Nature Seekers",
  "summary": "Join the highly qualified and friendly Nature Seekers tour guides as they take you on an enthralling journey to experience the ancient nesting ritual of the majestic…",
  "description": "Join the highly qualified and friendly Nature Seekers tour guides as they take you on an enthralling journey to experience the ancient nesting ritual of the majestic Leatherback Sea Turtles. At Matura Beach you will have the unique opportunity to be arms-length away from the largest sea turtles in the world as they engage in this ancient process. This is a fascinating and authentic experience in nature conservation and ideal for children. Check current opening arrangements, visitor access and any fees before travelling.",
  "status": "published",
  "confidence": "high",
  "createdAt": "2026-09-25T12:00:00.000Z",
  "updatedAt": "2026-09-25T12:00:00.000Z",
  "publishedAt": "2026-09-25T12:00:00.000Z",
  "checkedAt": "2026-09-25T12:00:00.000Z",
  "places": [
    {
      "name": "Nature Seekers",
      "area": "Toco",
      "region": "East Trinidad",
      "address": "Toco Main Road, Matura",
      "mapUrl": "https://natureseekers.org/"
    }
  ],
  "price": {
    "currency": "TTD",
    "amount": null,
    "fromAmount": null,
    "label": "Check admission",
    "terms": "The tourism listing does not provide a fixed price. Confirm current admission or guided-tour fees directly before travelling."
  },
  "validity": {
    "startsAt": null,
    "endsAt": null,
    "recurrence": "Ongoing attraction · check opening hours",
    "timezone": "America/Port_of_Spain"
  },
  "categories": [
    "activity",
    "attraction",
    "trinidad"
  ],
  "sources": [
    {
      "url": "https://visittrinbago.tt/attractions/nature-seekers",
      "publisher": "Visit Trinidad — official attractions directory",
      "type": "official",
      "supports": [
        "attraction",
        "location",
        "visitor access"
      ],
      "checkedAt": "2026-09-25T12:00:00.000Z"
    }
  ],
  "event": {
    "format": "Ongoing attraction visit",
    "admission": "The directory does not list a fixed admission fee. Contact the site before visiting."
  }
}
