{
  "schemaVersion": 2,
  "id": "activity-tombasson-waterfall-gunapo-waterfall-activity",
  "slug": "tombasson-waterfall-gunapo-waterfall-activity",
  "kind": "event",
  "title": "Tombasson Waterfall (Gunapo Waterfall)",
  "summary": "Located at the mouth of the Guanapo Gorge, this 35 - 40-foot waterfall plunges straight into a deep pool. Arriving at this fall requires navigating canyons, deep channels and…",
  "description": "Located at the mouth of the Guanapo Gorge, this 35 - 40-foot waterfall plunges straight into a deep pool. Arriving at this fall requires navigating canyons, deep channels and giant boulders. Listed opening hours: 24 HOURS. Verify access, opening times and any fees with the site before travelling.",
  "status": "published",
  "confidence": "high",
  "createdAt": "2026-09-25T12:00:00.000Z",
  "updatedAt": "2026-09-25T12:44:46.827Z",
  "publishedAt": "2026-09-25T12:00:00.000Z",
  "checkedAt": "2026-09-25T12:00:00.000Z",
  "places": [
    {
      "name": "Tombasson Waterfall (Gunapo Waterfall)",
      "area": "Trinidad",
      "region": "Trinidad",
      "address": "Gunapo",
      "mapUrl": "https://maps.app.goo.gl/M5SsbYcJ3EDqZubRA",
      "geolocation": {
        "latitude": 10.7091134,
        "longitude": -61.2573907,
        "crs": "EPSG:4326",
        "precision": "area",
        "source": {
          "provider": "Google Maps",
          "url": "https://maps.app.goo.gl/M5SsbYcJ3EDqZubRA"
        },
        "verifiedAt": "2026-09-25T12:44:46.794Z"
      }
    }
  ],
  "price": {
    "currency": "TTD",
    "amount": null,
    "fromAmount": null,
    "label": "Check admission",
    "terms": "The tourism listing does not provide a fixed price. Confirm current admission or guided-tour fees directly before travelling."
  },
  "validity": {
    "startsAt": null,
    "endsAt": null,
    "recurrence": "Ongoing attraction · check opening hours",
    "timezone": "America/Port_of_Spain"
  },
  "categories": [
    "activity",
    "attraction",
    "trinidad"
  ],
  "sources": [
    {
      "url": "https://visittrinbago.tt/attractions/tombasson-waterfall-gunapo-waterfall",
      "publisher": "Visit Trinidad — official attractions directory",
      "type": "official",
      "supports": [
        "attraction",
        "location",
        "visitor access"
      ],
      "checkedAt": "2026-09-25T12:00:00.000Z"
    }
  ],
  "event": {
    "format": "Ongoing attraction visit",
    "admission": "The directory does not list a fixed admission fee. Contact the site before visiting."
  }
}
