{
  "schemaVersion": 2,
  "id": "activity-visit-larry-gomes-stadium-activity",
  "slug": "visit-larry-gomes-stadium-activity",
  "kind": "event",
  "title": "Visit Larry Gomes Stadium",
  "summary": "Visit Larry Gomes Stadium in Arima, listed by the official tourism directory. Check event schedules and public access before travelling.",
  "description": "Visit Larry Gomes Stadium in Arima, listed by the official tourism directory. Check event schedules and public access before travelling. Check current opening hours, access, prices and booking requirements with the operator or official listing before travelling.",
  "status": "published",
  "confidence": "high",
  "createdAt": "2026-09-25T12:00:00.000Z",
  "updatedAt": "2026-09-25T12:00:00.000Z",
  "publishedAt": "2026-09-25T12:00:00.000Z",
  "checkedAt": "2026-09-25T12:00:00.000Z",
  "places": [
    {
      "name": "Arima",
      "area": "Arima",
      "region": "North Trinidad",
      "address": "Arima"
    }
  ],
  "price": {
    "currency": "TTD",
    "amount": null,
    "fromAmount": null,
    "label": "Check admission",
    "terms": "The referenced listing does not establish a fixed price. Confirm current admission, transport and booking fees directly before travelling."
  },
  "validity": {
    "startsAt": null,
    "endsAt": null,
    "recurrence": "Ongoing experience · check opening hours",
    "timezone": "America/Port_of_Spain"
  },
  "categories": [
    "activity",
    "sports",
    "trinidad"
  ],
  "sources": [
    {
      "url": "https://visittrinbago.tt/things-to-do/sports/",
      "publisher": "Visit Trinidad — official sports directory",
      "type": "official",
      "supports": [
        "activity listing",
        "experience details"
      ],
      "checkedAt": "2026-09-25T12:00:00.000Z"
    }
  ],
  "event": {
    "format": "Sports and recreation",
    "admission": "No fixed admission price is confirmed here; check with the operator or official listing."
  }
}
