{
  "schemaVersion": 2,
  "id": "activity-brij-maharaj-auto-and-heritage-museum-activity",
  "slug": "brij-maharaj-auto-and-heritage-museum-activity",
  "kind": "event",
  "title": "Brij Maharaj Auto & Heritage Museum",
  "summary": "For patrons of the Brij Maharaj Auto & Heritage Museum and enthusiasts of automotive heritage, national heritage and historic preservation.",
  "description": "For patrons of the Brij Maharaj Auto & Heritage Museum and enthusiasts of automotive heritage, national heritage and historic preservation. Listed opening hours: By appoinments only (Every 2nd Saturday or International Museum Day). Verify access, opening times and any fees with the site before travelling.",
  "status": "published",
  "confidence": "high",
  "createdAt": "2026-09-25T12:00:00.000Z",
  "updatedAt": "2026-09-25T12:44:46.801Z",
  "publishedAt": "2026-09-25T12:00:00.000Z",
  "checkedAt": "2026-09-25T12:00:00.000Z",
  "places": [
    {
      "name": "Brij Maharaj Auto & Heritage Museum",
      "area": "San Fernando",
      "region": "South Trinidad",
      "address": "#2 Hubert Rance Street, San Fernando",
      "mapUrl": "https://maps.app.goo.gl/sMr6ZBUg63JiBNhC9",
      "geolocation": {
        "latitude": 10.2878175,
        "longitude": -61.4641357,
        "crs": "EPSG:4326",
        "precision": "venue",
        "source": {
          "provider": "Google Maps",
          "url": "https://maps.app.goo.gl/sMr6ZBUg63JiBNhC9"
        },
        "verifiedAt": "2026-09-25T12:44:46.794Z"
      }
    }
  ],
  "price": {
    "currency": "TTD",
    "amount": null,
    "fromAmount": null,
    "label": "Check admission",
    "terms": "The tourism listing does not provide a fixed price. Confirm current admission or guided-tour fees directly before travelling."
  },
  "validity": {
    "startsAt": null,
    "endsAt": null,
    "recurrence": "Ongoing attraction · check opening hours",
    "timezone": "America/Port_of_Spain"
  },
  "categories": [
    "activity",
    "attraction",
    "trinidad"
  ],
  "sources": [
    {
      "url": "https://visittrinbago.tt/attractions/brij-maharaj-auto-heritage-museum",
      "publisher": "Visit Trinidad — official attractions directory",
      "type": "official",
      "supports": [
        "attraction",
        "location",
        "visitor access"
      ],
      "checkedAt": "2026-09-25T12:00:00.000Z"
    }
  ],
  "event": {
    "format": "Ongoing attraction visit",
    "admission": "The directory does not list a fixed admission fee. Contact the site before visiting."
  }
}
